{
  "$schema": "https://json-schema.org/draft/2020-12/schema",
  "$id": "https://nanoclaw.local/schemas/student-enrollment-production-admission-rollout-v1.json",
  "title": "NC-20260909-002 exact production-admission rollout packet",
  "type": "object",
  "additionalProperties": false,
  "required": [
    "schema_version",
    "packet_id",
    "status",
    "prepared_at_utc",
    "safety_contract_sha256",
    "objective",
    "authority",
    "lineage",
    "current_read_only_evidence",
    "population",
    "eligibility",
    "authenticated_native_proof",
    "writer_ownership",
    "accounting_continuity",
    "destinations",
    "migrations",
    "migration_runbook",
    "rollout",
    "duplicate_and_alias_assertions",
    "uncertain_acceptance",
    "rollback",
    "external_mutations",
    "owner_decisions",
    "forbidden_actions",
    "evidence_sources"
  ],
  "properties": {
    "schema_version": { "const": "1.0" },
    "packet_id": { "const": "NC-20260909-002" },
    "status": { "const": "prepared_not_authorized" },
    "prepared_at_utc": { "type": "string", "format": "date-time" },
    "safety_contract_sha256": { "type": "string", "pattern": "^[0-9a-f]{64}$" },
    "objective": { "type": "string", "minLength": 1 },
    "authority": { "$ref": "#/$defs/nonemptyObject" },
    "lineage": { "$ref": "#/$defs/nonemptyObject" },
    "current_read_only_evidence": { "$ref": "#/$defs/nonemptyObject" },
    "population": { "$ref": "#/$defs/nonemptyObject" },
    "eligibility": { "$ref": "#/$defs/nonemptyObject" },
    "authenticated_native_proof": { "$ref": "#/$defs/nonemptyObject" },
    "writer_ownership": { "$ref": "#/$defs/nonemptyObject" },
    "accounting_continuity": { "$ref": "#/$defs/nonemptyObject" },
    "destinations": {
      "type": "object",
      "additionalProperties": false,
      "required": ["student_roster", "heartbeat", "encharge", "plutio"],
      "properties": {
        "student_roster": { "$ref": "#/$defs/nonemptyObject" },
        "heartbeat": { "$ref": "#/$defs/nonemptyObject" },
        "encharge": { "$ref": "#/$defs/nonemptyObject" },
        "plutio": { "$ref": "#/$defs/nonemptyObject" }
      }
    },
    "migrations": {
      "type": "array",
      "minItems": 3,
      "maxItems": 3,
      "items": { "$ref": "#/$defs/nonemptyObject" }
    },
    "migration_runbook": { "$ref": "#/$defs/nonemptyObject" },
    "rollout": { "$ref": "#/$defs/nonemptyObject" },
    "duplicate_and_alias_assertions": { "$ref": "#/$defs/nonemptyStrings" },
    "uncertain_acceptance": { "$ref": "#/$defs/nonemptyObject" },
    "rollback": { "$ref": "#/$defs/nonemptyObject" },
    "external_mutations": { "$ref": "#/$defs/nonemptyStrings" },
    "owner_decisions": {
      "type": "array",
      "minItems": 1,
      "items": { "$ref": "#/$defs/nonemptyObject" }
    },
    "forbidden_actions": { "$ref": "#/$defs/nonemptyStrings" },
    "evidence_sources": { "$ref": "#/$defs/nonemptyObject" }
  },
  "$defs": {
    "nonemptyObject": {
      "type": "object",
      "minProperties": 1
    },
    "nonemptyStrings": {
      "type": "array",
      "minItems": 1,
      "items": { "type": "string", "minLength": 1 }
    }
  },
  "x-required-paths": [
    "safety_contract_sha256",
    "authority.work_item",
    "authority.owner_acceptance_required",
    "authority.execution_authorized",
    "authority.production_or_provider_writes_authorized",
    "authority.natural_event_only",
    "authority.historical_population_reads_allowed",
    "lineage.registration_commit",
    "lineage.reviewed_projection_closure",
    "lineage.reviewed_projection_implementation",
    "lineage.reviewed_admission_closure",
    "lineage.reviewed_admission_implementation",
    "lineage.reviewed_store_closure",
    "lineage.reviewed_store_implementation",
    "lineage.reviewed_publication_closure",
    "lineage.current_production_release",
    "lineage.current_production_parent",
    "lineage.current_production_source_tree",
    "lineage.current_production_artifact_sha256",
    "lineage.current_production_node",
    "lineage.integration_rule",
    "lineage.release_revalidation_required",
    "current_read_only_evidence.observed_at_utc",
    "current_read_only_evidence.production_host",
    "current_read_only_evidence.release_verified",
    "current_read_only_evidence.code_root_matches_release",
    "current_read_only_evidence.postgres_database",
    "current_read_only_evidence.postgres_version",
    "current_read_only_evidence.schema_observation",
    "current_read_only_evidence.schema_query_boundary",
    "current_read_only_evidence.provider_query_boundary",
    "population.maximum_natural_events",
    "population.offer_key",
    "population.offer_version",
    "population.bundle_key",
    "population.catalog_revision",
    "population.stripe_account",
    "population.canonical_source_object_type",
    "population.funding_state",
    "population.agreement_type",
    "population.currency",
    "population.gross_amount_minor",
    "population.discount_policy",
    "population.payer_relationship",
    "population.seat_count",
    "population.delivery_block_key",
    "population.delivery_program",
    "population.delivery_start_date",
    "population.event_must_be_received_after_activation",
    "population.known_historical_episode_replay_forbidden",
    "eligibility.all_required",
    "eligibility.refuse_or_preserve_legacy",
    "eligibility.refusal_behavior_before_writer_claim",
    "eligibility.refusal_behavior_after_writer_claim",
    "authenticated_native_proof.perimeter",
    "authenticated_native_proof.required_envelope_fields",
    "authenticated_native_proof.native_read_requirement",
    "authenticated_native_proof.production_issuer_requirement",
    "authenticated_native_proof.required_purposes",
    "authenticated_native_proof.canonical_writer_identity",
    "authenticated_native_proof.accepted_alias_types",
    "authenticated_native_proof.alias_rule",
    "writer_ownership.actual_ingress_paths",
    "writer_ownership.shared_orchestrator",
    "writer_ownership.atomic_gate",
    "writer_ownership.gate_transaction",
    "writer_ownership.one_event_budget_rule",
    "writer_ownership.legacy_writer_rule",
    "writer_ownership.canonical_writer_rule",
    "writer_ownership.raw_store_bypass_controls",
    "accounting_continuity.always_runs_for_authenticated_settled_payment",
    "accounting_continuity.independent_of_enrollment_acceptance",
    "accounting_continuity.stages",
    "accounting_continuity.failure_rule",
    "destinations.student_roster.disposition",
    "destinations.student_roster.spreadsheet_id",
    "destinations.student_roster.spreadsheet_title",
    "destinations.student_roster.sheet_id",
    "destinations.student_roster.sheet_title",
    "destinations.student_roster.current_header",
    "destinations.student_roster.required_operational_headers_f_through_m",
    "destinations.student_roster.apply_contract",
    "destinations.student_roster.readback_contract",
    "destinations.student_roster.idempotency_contract",
    "destinations.student_roster.uncertain_contract",
    "destinations.student_roster.rollback_contract",
    "destinations.student_roster.current_read_permission",
    "destinations.student_roster.current_write_permission",
    "destinations.student_roster.authorized_rollout_permission_preflight",
    "destinations.student_roster.activation_ready_now",
    "destinations.heartbeat.disposition",
    "destinations.heartbeat.workspace",
    "destinations.heartbeat.course_access_group_id",
    "destinations.heartbeat.course_access_group_name",
    "destinations.heartbeat.course_id",
    "destinations.heartbeat.current_access_group_observation",
    "destinations.heartbeat.marker_parent_name",
    "destinations.heartbeat.marker_parent_current_state",
    "destinations.heartbeat.delivery_marker_name",
    "destinations.heartbeat.delivery_marker_current_state",
    "destinations.heartbeat.marker_invariants",
    "destinations.heartbeat.creation_contract",
    "destinations.heartbeat.group_readback_contract",
    "destinations.heartbeat.membership_apply_contract",
    "destinations.heartbeat.membership_readback_contract",
    "destinations.heartbeat.uncertain_contract",
    "destinations.heartbeat.rollback_contract",
    "destinations.heartbeat.current_read_permission",
    "destinations.heartbeat.current_write_permission",
    "destinations.heartbeat.current_remove_capability",
    "destinations.heartbeat.current_full_invariant_readback",
    "destinations.heartbeat.authorized_rollout_permission_preflight",
    "destinations.heartbeat.activation_ready_now",
    "destinations.encharge.disposition",
    "destinations.encharge.offer_key",
    "destinations.encharge.offer_version",
    "destinations.encharge.reason",
    "destinations.plutio.disposition",
    "destinations.plutio.offer_key",
    "destinations.plutio.offer_version",
    "destinations.plutio.reason",
    "migrations.0.number",
    "migrations.0.file",
    "migrations.0.source_sha256",
    "migrations.0.rollback_file",
    "migrations.0.rollback_sha256",
    "migrations.0.current_production_state",
    "migrations.0.post_apply_readback",
    "migrations.1.number",
    "migrations.1.file",
    "migrations.1.source_sha256",
    "migrations.1.rollback_file",
    "migrations.1.rollback_sha256",
    "migrations.1.current_production_state",
    "migrations.1.post_apply_readback",
    "migrations.2.number",
    "migrations.2.file",
    "migrations.2.source_sha256",
    "migrations.2.rollback_file",
    "migrations.2.rollback_sha256",
    "migrations.2.current_production_state",
    "migrations.2.post_apply_readback",
    "migration_runbook.required_order",
    "migration_runbook.prerequisite_shape",
    "migration_runbook.backup",
    "migration_runbook.apply",
    "migration_runbook.ownership_and_grants",
    "migration_runbook.readback",
    "migration_runbook.pre_event_rollback_order",
    "migration_runbook.guarded_rollback",
    "migration_runbook.post_event_rule",
    "rollout.preflight",
    "rollout.activation.mode",
    "rollout.activation.policy_key",
    "rollout.activation.route",
    "rollout.activation.automatic_close",
    "rollout.milestones",
    "rollout.monitoring.window",
    "rollout.monitoring.checks",
    "rollout.monitoring.notification",
    "rollout.abort_triggers",
    "duplicate_and_alias_assertions",
    "uncertain_acceptance.canonical_commit",
    "uncertain_acceptance.student_roster",
    "uncertain_acceptance.heartbeat",
    "uncertain_acceptance.reconciliation_owner",
    "uncertain_acceptance.acceptance_rule",
    "rollback.before_event",
    "rollback.after_event",
    "rollback.provider_compensation",
    "rollback.post_rollback_verification",
    "external_mutations",
    "owner_decisions",
    "forbidden_actions",
    "evidence_sources.projection_contract",
    "evidence_sources.admission_contract",
    "evidence_sources.store_contract",
    "evidence_sources.lifecycle_strategy",
    "evidence_sources.product_identity",
    "evidence_sources.target_catalog",
    "evidence_sources.target_catalog_sha256",
    "evidence_sources.entitlement_catalog",
    "evidence_sources.entitlement_catalog_sha256",
    "evidence_sources.live_schema_snapshot",
    "evidence_sources.roster_metadata_snapshot",
    "evidence_sources.provider_metadata_receipt"
  ]
}
