{
  "schema_version": "1.0",
  "packet_id": "NC-20260909-002",
  "status": "prepared_not_authorized",
  "prepared_at_utc": "2026-09-10T01:45:49Z",
  "safety_contract_sha256": "e5b3a931707700810772e0354e5fda71d40d7abd1b7fc8baafc4e529fb4682e4",
  "objective": "Prepare, but do not execute, one future natural fully settled self-purchased supervision-inaugural v1 enrollment and its immediate Student Roster plus Heartbeat projections for supervision:2026-10-07.",
  "authority": {
    "work_item": "work:student-enrollment-production-admission-preparation",
    "change_class": "C2_preparation_future_C5_provider_and_identity_effect",
    "owner_acceptance_required": true,
    "execution_authorized": false,
    "production_or_provider_writes_authorized": false,
    "program_state_owner": "Astra",
    "execution_writer": "one_designated_Sol_High_worker",
    "independent_reviewer": "Claude_Code_Sonnet_high",
    "natural_event_only": true,
    "historical_population_reads_allowed": false
  },
  "lineage": {
    "registration_commit": "d849c091df387b896a18c5be971c28e50dff4f1c",
    "reviewed_projection_closure": "d9e298567ae87f48ae5b36152b3322fbbe9b73f6",
    "reviewed_projection_implementation": "deaab99ca4c756f54d22d8c6e6f9b2d4a91daf69",
    "reviewed_admission_closure": "8b1ffbb9902b5fd3f7df245142d54db3de92dcee",
    "reviewed_admission_implementation": "a46ecfe2c81e5aa624ee29472301e3d025a41d83",
    "reviewed_store_closure": "a382e21556c621c80202ee2a9cd072489f6ab295",
    "reviewed_store_implementation": "ef52b51d7d77d9f129608dd05f3d0d28de1e81e8",
    "reviewed_publication_closure": "55c068d2c39b9295b0a79ebe65369a3cc68172dc",
    "current_production_release": "726f2c80b3d45ccddf80bfa0fe796281f54b19b1",
    "current_production_parent": "55c068d2c39b9295b0a79ebe65369a3cc68172dc",
    "current_production_source_tree": "c7d3cf30170303eef0545e5d4603389d25ce6616",
    "current_production_artifact_sha256": "19263ee5b693f204e9dc647c006df0f5c05c2eb6d8c5f84fe184e926a11e3544",
    "current_production_node": "22.23.2",
    "integration_rule": "Build the pilot candidate from the then-current verified production release or a confirmed descendant, integrate the exact reviewed admission/store/projection source, and reconcile shared authorities by meaning. Never deploy d9e29856 directly over production.",
    "release_revalidation_required": true
  },
  "current_read_only_evidence": {
    "observed_at_utc": "2026-09-10T01:45:49Z",
    "production_host": "mini-claw.local",
    "release_verified": true,
    "code_root_matches_release": true,
    "gmail_connected": true,
    "slack_connected": true,
    "active_work_count": 0,
    "postgres_database": "nanoclaw_business",
    "postgres_version": "16.13",
    "schema_observation": "Migrations 142 through 145 are structurally present and admin-owned. Migration 146 version/evidence-history changes, migration 147 receipt/claim tables, and migration 148 delivery columns/indexes are absent.",
    "schema_query_boundary": "PostgreSQL catalog and information_schema metadata only; no business rows selected.",
    "provider_query_boundary": "Heartbeat group/course metadata and Student Roster row-1 header only; no users, memberships, or student rows selected."
  },
  "population": {
    "maximum_natural_events": 1,
    "offer_key": "supervision-inaugural",
    "offer_version": 1,
    "bundle_key": "coaching-supervision-mastery:v1",
    "catalog_revision": 1,
    "stripe_account": "tandem",
    "canonical_source_object_type": "payment_intent",
    "funding_state": "settled",
    "agreement_type": "paid_in_full",
    "currency": "usd",
    "gross_amount_minor": 399600,
    "discount_policy": "none_for_this_pilot",
    "payer_relationship": "self_purchase_explicit",
    "seat_count": 1,
    "delivery_block_key": "supervision:2026-10-07",
    "delivery_program": "supervision",
    "delivery_start_date": "2026-10-07",
    "event_must_be_received_after_activation": true,
    "known_historical_episode_replay_forbidden": true
  },
  "eligibility": {
    "all_required": [
      "The event is a future provider-authenticated payment_intent.succeeded or checkout.session.completed from the fixed Tandem Stripe trigger and carries one valid evt_ identity.",
      "The canonical Payment Intent is succeeded and fully settled as one undiscounted USD 399600-minor-unit paid-in-full agreement; installment, coupon/discount, invoice, sponsor, grant, refund, dispute, arrears, and partial-payment semantics are excluded.",
      "Account-scoped offer evidence resolves exactly to supervision-inaugural v1. Any supplied offer, product, price, checkout, charge, and event aliases agree with that route.",
      "Checkout metadata supplies cohort_program=supervision and cohort_start=2026-10-07; no name, amount, date, or email inference substitutes for either value.",
      "The purchase path explicitly attests one self-purchasing participant and the exact Party/participant proof is authenticated independently of payer email similarity.",
      "The delivery block, one seat pool, supervision-inaugural v1 offer mapping, numeric capacity, and positive availability are read back from accepted production authority before claim.",
      "There is no open or acknowledged exception for source, offer, terms, participant, relationship, capacity, assignment, writer, or projection readiness.",
      "Both required targets have exact destination identity, reviewed production adapters, apply/readback/uncertain/rollback paths, and current permission preflights before the writer claim.",
      "The persistent rollout budget has zero prior enrollment-owned writer claims for policy student_enrollment_supervision_inaugural_v1_one_event."
    ],
    "refuse_or_preserve_legacy": [
      "Any event received before the activation epoch or after the one-event budget is consumed.",
      "Any historical, manually pasted, synthetic, repaired, backfilled, or operator-selected payment.",
      "Any account other than tandem; any missing or invalid provider event identity; or any alias collision with another Contador or enrollment case.",
      "Any supervision-regular, mcs-full, unknown, unqualified, wrong-account, mixed-line, multi-seat, invoice, sponsor, grant, transfer, refund, dispute, payment-plan, or active-terms episode.",
      "Any absent/conflicting participant, self-purchase, cohort, schedule, delivery-block, capacity, offer, bundle, permission, marker, or destination evidence.",
      "Any target preflight drift, active writer claim, unclean release lineage, queue activity, migration mismatch, or backup failure."
    ],
    "refusal_behavior_before_writer_claim": "Do not divert the event. Leave the established Contador accounting and registration route intact, create no enrollment writer claim, and keep the pilot budget open unless the owner explicitly closes it.",
    "refusal_behavior_after_writer_claim": "Do not fall through to legacy registration. Preserve accounting and canonical evidence, open a durable owner or projection exception, hold uncertain effects, and close the one-event activation window."
  },
  "authenticated_native_proof": {
    "perimeter": "The live n8n stripe-payment workflow has separate Stripe Trigger credentials for heartbeat and tandem; each code node fixes its own account label and forwards a minimized authenticated envelope to NanoClaw.",
    "required_envelope_fields": [
      "account",
      "event_type",
      "event_id",
      "event_created",
      "stripe_id",
      "payment_intent_id"
    ],
    "native_read_requirement": "The host reloads the exact Payment Intent and, when applicable, Checkout Session, charge, line item, product, and price from the fixed Tandem account before constructing signed enrollment statements.",
    "production_issuer_requirement": "Replace synthetic issuer fixtures with host-owned provider-event and provider-read issuers whose keys are provisioned privately, purpose-scoped, distinct, time-bounded, and never persisted or exposed.",
    "required_purposes": ["funding", "commercial", "participant", "assignment"],
    "canonical_writer_identity": "stripe:tandem/payment_intent/<pi_id>",
    "accepted_alias_types": [
      "event",
      "checkout_session",
      "payment_intent",
      "charge"
    ],
    "alias_rule": "All observed aliases bind to the same account-scoped Payment Intent and one enrollment order; replay of any alias cannot create another writer claim, order, seat, enrollment, assignment, roster row, or Heartbeat membership.",
    "correction_rule": "migration_or_correction remains review-only and cannot enter this pilot."
  },
  "writer_ownership": {
    "actual_ingress_paths": [
      {
        "path": "src/webhook-server.ts",
        "entry": "stripe-payment request-time host handler",
        "required_call": "handleStripePayment"
      },
      {
        "path": "src/webhook-inbox-reaper.ts",
        "entry": "stripe-payment durable retry handler",
        "required_call": "handleStripePayment"
      }
    ],
    "shared_orchestrator": "src/stripe-payment-host.ts#handleStripePayment",
    "atomic_gate": "src/student-enrollment-admission.ts#claimEnrollmentWriter",
    "gate_transaction": "The canonical source claim, authenticated receipts, canonical enrollment decision, outbox requests, and exact readback commit in one SERIALIZABLE transaction under the fixed enrollment table locks.",
    "one_event_budget_rule": "Under the same writer-claim table lock, refuse an enrollment claim when any row already has policy_key=student_enrollment_supervision_inaugural_v1_one_event and writer=enrollment; exact aliases of the same source remain no-op replays.",